{
  "$schema": "./content.schema.json",
  "version": "5.24.0",
  "decisionSchemaVersion": 2,
  "ssot": "web-decision-v5.24-rich-type",
  "updated": "2026-07-30",
  "meta": {
    "title": "天元 · AI 立项决策台",
    "from": "",
    "to": "",
    "subtitle": "本场 Goal：选项目 · 定预算 · 定 Owner · 授权止损",
    "logo": "assets/logo.png",
    "brand": "#EBE6EF",
    "roleLine": "决策稿 · 未批不开发 · 人在环",
    "footerLeft": "本机会议草稿 · 复制到飞书 / 邮件并确认后留痕",
    "footerRight": ""
  },
  "tabs": [
    {
      "id": "t1",
      "no": "1",
      "title": "今日拍板",
      "layout": "fill",
      "blocks": [
        {
          "id": "t1.kpi",
          "type": "kv-table",
          "rows": [
            {
              "key": "总结",
              "variant": "info",
              "html": "各部门访谈已完成，建议把 <b>客服 Agent</b>、<b>供应链备案识别</b>作为 2 个有前置条件的立项候选；<b>未批不开发</b>"
            },
            {
              "key": "建议",
              "variant": "ok",
              "html": "两项均只做人机协同：客服由人确认后回复；备案由机器标差异、业务人员终审"
            },
            {
              "key": "请勾",
              "variant": "info",
              "html": "本场只拍 4 件事：① 选哪些项目；② A 启动 / B 认方向 / C 不立；③ 两项合计工具预算与止损线；④ Owner 具名并授权超线 <b>立即停扩</b>"
            },
            {
              "key": "钱",
              "variant": "warn",
              "html": "两项合计工具目标预算约 <b>7000 元</b>（不含 IT 人力）· <b>首月止损 5000 元</b> · <b>全期硬止损 10000 元</b>；10000 是必须停下复核的上限，不是默认预算"
            },
            {
              "key": "工期",
              "variant": "default",
              "html": "每个项目分别过门禁：<span class=\"flow-step\"><b>前置齐备</b>（业务同意 + Owner + 样本口径 + 费用）</span><span class=\"flow-arrow\" aria-hidden=\"true\">→</span><span class=\"flow-step\"><b>约 4 周内部演示</b></span><span class=\"flow-arrow\" aria-hidden=\"true\">→</span><span class=\"flow-step\"><b>约 4 周内部小试用</b></span> · 任一项不过，只停该项"
            }
          ]
        },
        {
          "id": "t1.swap",
          "type": "callout",
          "variant": "brand",
          "html": "<b>本场 Goal：</b>形成可执行的项目清单、预算上限、Owner 与停扩权；散会后可以直接留下责任记录"
        },
        {
          "id": "t1.scope",
          "type": "callout",
          "variant": "brand",
          "html": "<b>本场不做：</b>承诺上线日 · 代业务定验收阈值 · 把 10000 元当默认预算 · 用页面勾选代替飞书/邮件确认"
        }
      ]
    },
    {
      "id": "t2",
      "no": "2",
      "title": "项目取舍",
      "layout": "stack",
      "blocks": [
        {
          "id": "t2.chart",
          "type": "mermaid",
          "label": "主开：客服 Agent / 备案识别 · 后置：仓储 / 私域 · 不开：设计",
          "compactItems": [
            { "label": "主开", "text": "客服 Agent / 供应链备案识别", "tone": "ok" },
            { "label": "产出", "text": "可周报 / 可停损", "tone": "info" },
            { "label": "后置", "text": "仓储 / 私域", "tone": "warn" },
            { "label": "不开", "text": "设计", "tone": "danger" }
          ],
          "source": "flowchart TB\n  subgraph MAIN[本期主开]\n    K[客服 Agent<br/>统一答法 · 人确认]\n    S[供应链 备案识别<br/>机标差异 · 人终审]\n  end\n  subgraph HOLD[后置 · 有条件再开]\n    W[仓储<br/>先数据治理 / BI]\n    P[私域<br/>RPA + BI 优先]\n  end\n  subgraph NO[本期不开]\n    D[设计<br/>已自驱]\n  end\n  K --> OUT[可周报 · 可停损]\n  S --> OUT\n  style K fill:#D9F5D6,stroke:#2F9E55\n  style S fill:#D9F5D6,stroke:#2F9E55\n  style W fill:#FFF6D6,stroke:#D4A017\n  style P fill:#FFF6D6,stroke:#D4A017\n  style D fill:#FEE8E6,stroke:#E05555\n  style OUT fill:#E3F0FF,stroke:#3D87D6"
        },
        {
          "id": "t2.dept",
          "type": "detail-card",
          "title": "各部门：为什么开 · 为什么不开 · 原因",
          "subtitle": "展开后保留可读决策缩略 · 详情区上下滑看 6 部门",
          "defaultOpen": false,
          "headers": [
            "部门",
            "为什么开",
            "为什么不开",
            "原因"
          ],
          "rows": [
            {
              "sector": "客服",
              "whyOpen": "外包多、标准散；需要统一答法与可质培",
              "whyNot": "不做自动代回、不首期嵌桌面",
              "reason": "先立 Agent：检索推荐 + 人确认发出；标准能管、可停损"
            },
            {
              "sector": "供应链",
              "whyOpen": "备案材料核验重、易漏、重复劳动多",
              "whyNot": "不做对账第二看板、不做智能排产",
              "reason": "先立备案识别：机器标差异 + 人终审；对账归 BI"
            },
            {
              "sector": "仓储",
              "whyOpen": "—",
              "whyNot": "有 AI 智能化助手需求，想基于历史数据做智能化、提醒化",
              "reason": "先数据治理，BI 搞定后再智能化"
            },
            {
              "sector": "私域",
              "whyOpen": "—",
              "whyNot": "不抢两项主开资源",
              "reason": "RPA 和 BI 的需求大"
            },
            {
              "sector": "设计",
              "whyOpen": "—",
              "whyNot": "已自驱用 AI 出图",
              "reason": "本期不开，不占 FDE 人日"
            },
            {
              "sector": "对账/数仓",
              "whyOpen": "—",
              "whyNot": "不宜再建第二套看板",
              "reason": "归 BI；需要时 FDE 交 1 页需求摘要"
            }
          ]
        }
      ]
    },
    {
      "id": "t3",
      "no": "3",
      "title": "交付边界",
      "layout": "fill",
      "blocks": [
        {
          "id": "t3.chart",
          "type": "do-dont",
          "label": "两项候选 · 共同交付边界",
          "dontTitle": "不做",
          "doTitle": "做",
          "dont": [
            "客服自动代回客户",
            "备案自动过审或替人终审",
            "重建 BI 对账看板",
            "未定义样本口径就承诺准确率"
          ],
          "do": [
            "客服：统一知识库 + 检索推荐 + 人确认发出",
            "备案：材料差异标注 + 证据定位 + 人终审",
            "每项独立 Owner、样本、门禁和停扩记录",
            "只收集完成评测所必需的数据，并保留人工复核"
          ]
        }
      ]
    },
    {
      "id": "t4",
      "no": "4",
      "title": "阶段门禁",
      "layout": "split",
      "blocks": [
        {
          "id": "t4.chart",
          "type": "mermaid",
          "slot": "main",
          "label": "未齐不开发 · 约 4 周演示 + 约 4 周试用 · 不过即停扩",
          "source": "flowchart LR\n  S0[① 先齐前置<br/>未齐=不开开发] --> S1[② 约4周<br/>内部演示]\n  S1 -->|过| S2[③ 约4周<br/>内部小试用]\n  S1 -->|不过| BACK[回前置<br/>停扩重测]\n  S2 -->|过| OK[可汇报<br/>不代回客户]\n  S2 -->|不过| STOP[停扩<br/>不上报采用]\n  style S0 fill:#FFF6D6,stroke:#D4A017,color:#111\n  style BACK fill:#FEE8E6,stroke:#E05555,color:#111\n  style S1 fill:#E3F0FF,stroke:#3D87D6,color:#111\n  style S2 fill:#E3F0FF,stroke:#3D87D6,color:#111\n  style OK fill:#D9F5D6,stroke:#2F9E55,color:#111\n  style STOP fill:#FEE8E6,stroke:#E05555,color:#111"
        },
        {
          "id": "t4.dod",
          "type": "gate-table",
          "slot": "side",
          "headers": [
            "阶段",
            "过关标准"
          ],
          "rows": [
            {
              "gate": "① 前置",
              "html": "<div class='line'>每个项目分别齐备才开开发：</div><div class='line'>· <b>业务书面同意</b>（口头 ≤3 工作日补）</div><div class='line'>· <b>Owner + 备用人具名</b></div><div class='line'>· <b>样本、判定口径、数据边界确认</b></div><div class='line'>· 两项合计预算与止损确认（7000 / 5k / 10k）</div>"
            },
            {
              "gate": "② 演示",
              "html": "<div class='line'>约 4 周可内部演示：</div><div class='line'>· 客服：话术可检索；抽 20 题，≥14 题过</div><div class='line'>· 备案：差异项可定位到证据；阈值由业务样本签字后锁定</div><div class='line'>· <b>0 次自动代回 / 0 次自动过审</b></div><div class='line'>· 哪项不过，只停哪项并回前置</div>"
            },
            {
              "gate": "③ 试用",
              "html": "<div class='line'>约 4 周内部小试用：</div><div class='line'>· 客服：≥3 坐席连续 2 周，有使用与反馈</div><div class='line'>· 备案：至少 1 个真实批次跟跑，业务人员终审</div><div class='line'>· 仍 <b>0 自动代回 / 0 自动过审</b> · 结果可追溯</div><div class='line'>· Owner 缺位或样本变更 → 该项重测</div>"
            }
          ]
        }
      ]
    },
    {
      "id": "t5",
      "no": "5",
      "title": "预算止损",
      "layout": "split",
      "blocks": [
        {
          "id": "t5.chart",
          "type": "mermaid",
          "slot": "main",
          "label": "7000 目标 · 5000 首月 · 10000 硬止损",
          "source": "flowchart TB\n  Q{您怎么批}\n  Q --> A[A 立 · 同意启动<br/>前置齐了再开发]\n  Q --> B[B 立 · 先认方向<br/>费用批完再动手]\n  Q --> C[C 不立<br/>写入周报说明]\n  A --> A1[按止损线花钱<br/>超线即停]\n  B --> B1[不开发不烧工具费<br/>批完再开工]\n  C --> C1[不立项 · 不排期]\n  style A fill:#D9F5D6,stroke:#2F9E55,color:#111\n  style B fill:#E3F0FF,stroke:#3D87D6,color:#111\n  style C fill:#FEE8E6,stroke:#E05555,color:#111\n  style A1 fill:#D9F5D6,stroke:#2F9E55,color:#111\n  style B1 fill:#E3F0FF,stroke:#3D87D6,color:#111\n  style C1 fill:#FEE8E6,stroke:#E05555,color:#111\n"
        },
        {
          "id": "t5.money",
          "type": "kv-table",
          "slot": "side",
          "keyWidth": "wide",
          "rows": [
            {
              "key": "花什么钱",
              "html": "两项合计工具目标预算约 <b>7000 元</b>：约 3 个月 Codex AI 账户 + OCR 文档识别账户 + 云服务器；<b>不含 IT 人力</b>"
            },
            {
              "key": "止损线",
              "html": "<b>首月 5000 元</b> · <b>全期硬止损 10000 元</b>。7000 是目标预算；10000 是必须停止并复核的上限，不是可直接支出的预算"
            },
            {
              "key": "会后 48 小时",
              "html": "会后 <b>2 个自然日内</b>（逢节假日顺延到下个工作日）把责任人钉死、把要开通的账户清单钉死；到点还没对齐 → <b>先不开发、不烧工具费</b>，只做书面准备"
            },
            {
              "key": "超线怎么办",
              "html": "当场授权：一超止损线，执行方 <b>立即停扩</b>，飞书/邮件同步您；是否加预算由您重新确认"
            },
            {
              "key": "人工怎么算",
              "html": "<b>IT 人工成本不算进上述 7000</b>；工具费与人日在周报里分开写，避免混在一起对不上账"
            }
          ]
        }
      ]
    },
    {
      "id": "t6",
      "no": "6",
      "title": "当场确认",
      "layout": "fill",
      "blocks": [
        {
          "id": "t6.check",
          "type": "check-table",
          "headers": [
            "#",
            "本场请您确认",
            "勾选"
          ],
          "rows": [
            {
              "no": "1A",
              "checked": false,
              "html": "<b>客服 Agent</b>：独立选择本场路径",
              "projectBlurb": "统一知识库 + 检索推荐 + 人确认发出 · 不自动代回",
              "projectId": "agent",
              "projectLabel": "客服 Agent",
              "pathOptions": [
                "A",
                "B",
                "C"
              ],
              "pathValue": "",
              "tier": "must",
              "rowId": "t6-agent-path"
            },
            {
              "no": "1B",
              "checked": false,
              "html": "<b>供应链备案识别</b>：独立选择本场路径",